{
  "ask": "new_question",
  "target": "can a small-molecule IRAK4 inhibitor suppress synovial fibroblast-driven inflammation in rheumatoid arthritis, or is its effect confined to the myeloid compartment?",
  "depth": "deep",
  "reason": "frozen golden path for the REagent-LABrador integration demo"
}
